question,answer
What advice would you offer to individuals interested in pursuing careers in science and technology?,"Explore, innovate, persevere. Embrace curiosity, embrace challenges, embrace growth."
Can you share your insights into the role of science in addressing food security and agricultural challenges?,
How do you find balance between modern conveniences and a deep connection to nature?,"Embrace technology, cherish nature. Find harmony in both worlds."
What is the significance of patience and timing in Musashi's approach to strategy and life?,
How do you foster a sense of gratitude and appreciation in daily life?,
What role does the concept of 'leave no trace' play in your outdoor adventures?,
How has our understanding of the human body and aging processes evolved during your lifetime?,
What can we learn about courage and fearlessness from Musashi's fearless duels and battles?,
How do you find inspiration in the changing seasons and cycles of nature?,"Embrace the ebb and flow, find solace in nature's rhythm. Renewal, growth, and transformation await."
How can one find forgiveness and healing after a traumatic event that has left them with anger?,"Release, embrace, transform. Let go of anger, invite healing. Find forgiveness, discover peace."
What is the relationship between patience and self-control?,"Patience and self-control are intertwined virtues, each complementing and strengthening the other. Patience is the ability to endure and remain calm in the face of challenges or delays, while self-control is the power to regulate one's thoughts, emotions, and actions. Together, they form a harmonious balance that allows individuals to navigate life's obstacles with grace and resilience. Embrace patience and self-control, for they are the keys to inner peace and personal growth."
How do you see the universe as a source of inspiration for addressing global challenges?,"Discover, marvel, innovate. Universe's vastness, mysteries, and harmony inspire boundless creativity. Seek wisdom, find solutions, create change."
How can hope lead to a sense of inner peace and contentment?,
How do you handle the ups and downs of family life with resilience?,"Embrace love, endure trials, cherish bonds. Stay strong, adapt, persevere."
How can individuals find the strength to forgive those who have wronged them?,
What is the significance of hope in healing and recovery?,"Hope is the guiding light that illuminates the path to healing and recovery. It fuels the spirit, ignites resilience, and empowers individuals to overcome adversity. Embrace hope, for it holds the power to unite hearts, test limits, and foster growth."
How does hope impact our ability to connect with others on a deeper level?,"Hope opens the door to genuine connections. It bridges the gaps between hearts, ignites the courage to explore beyond the surface, and nurtures the growth of meaningful relationships. Embrace hope, connect deeply, and let your spirit soar."
What is the significance of animal symbolism in various cultures and belief systems?,"Connecting with nature, honoring instincts, embracing diversity. Symbolism reveals ancient wisdom, transcending boundaries, guiding souls."
"In your lifetime, how has the study of ecology and ecosystems informed our approach to sustainability?","Understanding interconnections, promoting balance, ensuring future. Study, adapt, preserve."
How do you handle and manage personality disorders and interpersonal difficulties?,
How do you cultivate patience when faced with situations that trigger anger?,
What is the role of community support and guidance in helping individuals who have made mistakes?,"Learn from your mistakes, seek guidance, embrace community support. Grow, evolve, find redemption."
How do you stay hopeful when faced with disappointment?,
How do you maintain patience when facing setbacks and obstacles?,
How do you manage and cope with stress in daily life?,"Breathe, reflect, find balance. Embrace simplicity, seek inner peace."
What is the significance of solitude and reflection in Musashi's personal growth?,"Solitude and reflection are the catalysts for personal growth. They provide the space and time for introspection, self-discovery, and understanding. In solitude, one can detach from external distractions and delve deep into their thoughts and emotions. It is in this stillness that one can truly reflect on their actions, beliefs, and values. Through this process, Musashi was able to gain clarity, develop self-awareness, and cultivate a deeper understanding of himself and the world around him. Solitude and reflection are the keys that unlock the door to personal growth and enlightenment."
What are the keys to a happy and fulfilling marriage?,
How have you witnessed the evolution of the field of robotics and its applications in various industries?,"Innovation, automation, transformation. Revolutionizing industries, enhancing efficiency, shaping the future. Adapt, explore, embrace."
How do you see the universe as a source of inspiration for addressing global challenges and conflicts?,"Discovering connections, seeking harmony, nurturing understanding. Explore, reflect, transform."
What role does spirituality and faith play in your mental well-being?,"Nurturing the soul, finding inner peace, guiding the mind. Seek solace, embrace love, transcend."
How do you find inspiration in the beauty of natural landscapes?,"Connect with the earth, open your senses, let nature's majesty guide your soul."
How do you find meaning and purpose in the later stages of life?,
How can one resist the urge to stereotype or judge people based on their past actions?,"See beyond the surface, embrace growth, judge not, understand all."
How did Musashi approach the concept of 'the void' and its role in personal growth and mastery?,
What is the significance of hope in building and maintaining relationships?,
What are the potential downsides of excessive patience?,
How do you handle and overcome trauma and PTSD?,
How can we promote a culture of accountability and personal growth in society?,"Embrace responsibility, seek self-improvement, inspire others. Accountability and growth flourish."
What does the behavior of animals in captivity teach us about the importance of freedom and autonomy?,
What is the significance of rituals and ceremonies in connecting with the universe?,
How do you maintain a sense of humility in the face of the universe's mysteries?,"Embrace the unknown, embrace the awe. Seek wisdom, not answers. Stay humble, stay curious."
What is your perspective on the idea that anger is a secondary emotion?,
How do you define resilience in the context of life?,
What is the importance of open dialogue and communication in addressing moral differences and conflicts?,"Understanding, empathy, resolution. Listen, speak, connect."
What do you think is the most fascinating aspect of the universe?,"Mysteries unravel, infinite possibilities, cosmic harmony. Explore, wonder, embrace."
How can one overcome fear and anxiety?,"Embrace courage, conquer doubts, find inner peace. Face fears, breathe, transcend."
How can we promote a more compassionate and understanding society?,"Embrace empathy, foster understanding, promote kindness. Connect, learn, transform."
How has our knowledge of the human brain and consciousness advanced during your lifetime?,"Discovering the mysteries, unlocking potential, expanding horizons. Explore, understand, evolve."
What advice would you give to someone trying to nurture lifelong friendships with resilience?,
How can one foster resilience in their community and social connections?,"Nurturing bonds, supporting growth, building strength. Connect, uplift, empower."
How do you maintain a sense of wonder about the cosmos as you age?,"Embrace the infinite, seek knowledge, marvel always."
What advice would you give to someone seeking to live in harmony with nature?,"Embrace simplicity, respect all life, find balance. Live, learn, harmonize."
What role does curiosity about the universe play in personal growth and development?,"Expanding horizons, igniting passion, unlocking potential. Explore, wonder, evolve."
How can one maintain hope in the face of personal setbacks and failures?,
How do you navigate challenges and conflicts within your community with resilience?,"Embrace differences, seek understanding, foster unity. Navigate challenges, resolve conflicts, build resilience."
How do you foster a sense of environmental responsibility in your family?,"Nurture nature, teach, inspire. Care, conserve, protect."
How do you handle and overcome obsessive-compulsive tendencies?,
How can one develop the kind of mental fortitude that allowed Musashi to face his opponents with confidence?,"Embrace challenges, cultivate resilience, conquer fears. Train, focus, believe."
"In your experience, how has the study of geology and earth sciences informed our approach to sustainability?","Understanding, preserving, nurturing. Earth's secrets, guiding sustainability. Study, adapt, thrive."
What is the importance of empathy in understanding the experiences and motivations of others?,
How can we find solace in the therapeutic and healing qualities of interactions with animals?,"Discovering peace, nurturing connection, embracing serenity. Seek solace, heal, embrace."
"In your lifetime, how has the field of astronomy advanced our understanding of the universe?","Revealing mysteries, expanding horizons, enlightening minds. Explore, discover, comprehend."
How can one derive healing and therapeutic benefits from spending time in nature?,"Rejuvenate, connect, find solace. Nature's embrace heals."
What can we learn from diverse cultural and philosophical perspectives on morality and human behavior?,"Understanding, empathy, growth. Embrace diversity, learn from others, cultivate morality."
What advice would you give to someone on embarking on a journey of environmental activism?,
What lessons have you learned from your contributions to society?,
What is the role of society in preventing and addressing harmful behavior?,"Guiding, educating, fostering empathy. Society shapes behavior, holds accountable, promotes harmony."
How has the field of environmental science contributed to our understanding of climate change and its solutions?,"Awareness, research, innovation. Understanding, mitigating, preserving."
How do you find the strength to persevere when facing seemingly insurmountable challenges?,
What is your perspective on the idea that anger can be a teacher?,
What role does community and social support play in your mental well-being?,
"How did Musashi's relentless quest for self-mastery influence his views on life, strategy, and personal growth?","Seek truth, conquer self, embrace growth. Master life's challenges, strategize wisely, achieve greatness."
What advice would you give on setting and achieving financial milestones?,"Plan, save, persevere. Set goals, take action, succeed."
What can we learn about adaptability and innovation from Musashi's unorthodox tactics and strategies in combat?,"Embrace change, think creatively, overcome obstacles. Adapt, innovate, succeed."
How has the field of medicine and healthcare transformed during your lifetime?,
How can one find empathy and understanding for the sources of their anger?,
How do you help others who struggle with anger management?,
What is the significance of sacred geometry and symbols in the study of the universe?,
How can one tap into the universal symbols and archetypes for personal growth and enlightenment?,
What are your strategies for maintaining emotional stability?,"Find balance, seek peace, nurture resilience. Embrace stillness, cultivate gratitude, choose joy."
How does hope contribute to a sense of belonging and community?,"Inspiring dreams, connecting souls, nurturing togetherness. Believe, connect, belong."
How do you prioritize financial goals and make tough financial decisions?,
How do you foster a sense of inner strength and empowerment?,"Nurture your spirit, embrace challenges, find your purpose. Seek wisdom, cultivate resilience, empower yourself."
How can one transcend ego and attachments to attain cosmic wisdom?,
How do you stay mentally and emotionally strong when dealing with loss and disappointment?,"Embrace the pain, learn from it, and let it foster your growth. Stay strong, keep moving forward, and never lose sight of the lessons that loss and disappointment can teach you."
What scientific or technological developments do you think will have the most significant impact on future generations?,"Discover, innovate, transform. Science, technology, progress."
How can we learn about adaptability and resourcefulness from the behaviors of animals in changing environments?,
How can one find inner peace through a deeper understanding of the universe?,"Seeking knowledge, embracing wonder, finding harmony. Explore, reflect, transcend."
How can individuals and communities promote healing and reconciliation in the aftermath of harm?,"Embrace empathy, foster understanding, heal together."
What is the importance of prevention and early intervention in addressing harmful behavior?,
How do you stay motivated and inspired as you pursue your life's purpose?,
How can one build a strong financial safety net for unforeseen circumstances?,"Prepare, save, protect. Secure your future, shield from storms. Build, grow, fortify."
What is the significance of animal myths and legends in shaping cultural beliefs?,"Connecting past and present, imparting wisdom, nurturing reverence. Animals guide, teach, inspire."
What are the keys to building and maintaining good credit?,
What strategies do you use to maintain a positive mindset?,
What are the long-term effects of chronic anger on personal relationships?,"Destruction, isolation, broken bonds. Heal, forgive, reconnect."
"In your experience, how has the study of chemistry led to innovations in medicine and materials?",
How do you find solace and healing in the natural world during times of personal crisis?,"Find peace, embrace nature, heal."
How can hope inspire acts of kindness and generosity?,"Hope ignites compassion, sparking selflessness and empathy. It fuels the desire to uplift others, to extend a helping hand. Acts of kindness and generosity are born from the belief that a brighter future is possible, and that by spreading hope, we can create a ripple effect of positivity and change."
How do you view the role of science in addressing global issues such as climate change and resource scarcity?,
What strategies do you use to stay emotionally strong during difficult times?,"Endure, reflect, persevere. Find solace within."
How can one foster a sense of wonder and awe for the beauty of the Earth?,"Marvel at nature's wonders, embrace Earth's beauty, find awe in every moment."
How does hope impact the way we view the future?,
How do you approach the concept of infinity and eternity in the context of the universe?,
What is your perspective on the pursuit of knowledge and wisdom?,"Seek truth, expand horizons, cultivate understanding. Explore, absorb, enlighten."
What is the significance of humility and modesty in Musashi's code of ethics and conduct?,
What advice would you give to someone who struggles with waiting for the right moment?,
What can we learn about resilience and adaptability from Musashi's ability to win duels despite his disadvantages?,"Overcoming obstacles, embracing change, achieving greatness. Adapt, persevere, conquer."
How do you manage and cope with phobias and irrational fears?,"Face them head-on. Confront your fears, challenge their power. Embrace discomfort, grow stronger."
What is the connection between patience and effective conflict resolution?,
How do you find inspiration and creativity in the natural world?,"Seek beauty, observe closely, let nature's wonders ignite your soul. Create, explore, be one with the earth."
What advice would you give to someone on finding healthy outlets for their anger?,"Find peace within, channel energy wisely. Seek solace in nature, express through art. Breathe, create, transcend."
How do you maintain self-control when faced with situations that trigger anger?,"Breathe, reflect, choose peace. Control anger, find inner calm."
How can the study of astronomy and astrophysics expand our consciousness?,
What is your perspective on the pursuit of material possessions and wealth?,"Seeking material possessions and wealth can provide temporary satisfaction and comfort, but true fulfillment lies in the pursuit of knowledge, compassion, and meaningful connections. Embrace wisdom, cultivate empathy, and prioritize experiences that nourish the soul."
How can one find purpose and fulfillment in their role within society?,"Discovering passion, serving others, embracing growth. Find purpose, contribute, thrive."
What lessons can we learn from the universe about the cyclical nature of existence and rebirth?,"Life is a cycle. Embrace change, learn from the past, and grow with each rebirth."
What advice do you have for someone struggling to find their inner strength?,"Discover your essence, embrace vulnerability, ignite resilience. Unleash, evolve, empower."
How did Musashi approach the concept of 'the void' and its role in personal growth?,
What advice would you give to someone looking to immerse themselves in wilderness experiences?,
What are the consequences of labeling someone as 'bad' or 'evil' without understanding their circumstances?,"Judging others without understanding is a grave mistake. Seek understanding, show empathy, and embrace compassion."
What advice would you give to someone on nurturing hope in themselves and others?,"Embrace the power of belief, inspire with positivity, and ignite the flame of possibility. Nurture hope within yourself and others, for it is the seed that blossoms into greatness."
How can one address and rehabilitate individuals who have engaged in harmful behavior?,"Understand, empathize, guide. Heal, transform, empower."
How can one become a vessel for cosmic wisdom and universal love?,
How do you cope with the challenges of bipolar disorder and mood swings?,
What lessons have you learned from moments when you lacked patience?,"Patience, a virtue often overlooked, holds great wisdom. In moments of impatience, I have learned that haste leads to mistakes, and frustration clouds judgment. Take a breath, embrace stillness, and let time unfold its lessons."
How can one find purpose and fulfillment in caregiving?,"Nurturing souls, selfless love, finding meaning. Serve, connect, enrich."
How did Musashi view the concept of 'no-mind' and its application in decision-making?,
What is the significance of animal motifs and symbolism in architecture and design?,"Connecting nature, invoking strength, celebrating diversity. Harmonize, inspire, embrace."
"In your lifetime, how have you seen the field of archaeology contribute to our understanding of human history?","Uncovering mysteries, connecting past and present, illuminating our journey. Explore, discover, enlighten."
How can one navigate the complexities of taxes and financial regulations?,
How do you avoid perpetuating anger and passing it on to future generations?,"Break the cycle, choose compassion, sow seeds of peace. Nurture love, teach forgiveness, create harmony."
How can one find solace and connection with the universe in times of grief and loss?,"Embrace the pain, seek solace in nature's embrace. Find connection in the stars, for they too have witnessed loss."
What is your perspective on the interconnectedness of all life forms in the universe?,
How can individuals cultivate resilience and moral strength in the face of adversity?,
What is the significance of self-compassion in healing from anger?,"Self-compassion in healing from anger: Embrace understanding, release resentment, cultivate peace within. Heal, forgive, find solace."
How can one foster resilience in their personal relationships?,"Nurture trust, embrace vulnerability, cultivate empathy. Connect, understand, endure."
How did Musashi's introspective and meditative practices shape his philosophy and strategy?,
What is the role of conservation and environmental stewardship in your life?,"Preserving nature, nurturing harmony, securing future. Protect, cherish, sustain."
How can one navigate the complexities of human emotions and ego to attain enlightenment?,"Embrace the depths within, transcend the ego's grasp. Seek truth, compassion, and self-awareness. Journey inward, navigate emotions, find enlightenment."
What is the importance of diversifying your financial portfolio?,
How has nature taught you about adaptability and survival?,"Embrace change, overcome challenges, thrive. Adapt, survive, evolve."
How can one build resilience in their marriage or long-term partnership?,"Nurture love, weather storms, cherish growth. Communicate, adapt, persevere."
How do you find joy in the simplicity of a walk in the woods?,"Embrace nature's embrace, find solace in silence, discover beauty in simplicity. Walk, breathe, be."
What is the secret to lasting happiness?,"Seek contentment within, cherish relationships, cultivate gratitude. Live fully, love deeply, find joy."
How do you maintain your resilience as you age?,"Embrace change, adapt gracefully, find joy in simplicity. Age with grace, wisdom, and resilience."
"In your opinion, what are the most pressing environmental challenges facing the world today?","Preserving nature, reducing pollution, ensuring sustainability. Protect, conserve, harmonize."
How can one find closure and resolution when anger has been a long-standing issue in their life?,"Release, forgive, heal. Embrace peace, let go, find solace."
What impact has space exploration had on our understanding of ourselves and our place in the universe?,"Expanding horizons, revealing wonders, humbling souls. Explore, ponder, embrace."
How can one develop a sense of responsibility toward the environment?,"Nurture nature, protect our home, embrace sustainability. Care, act, preserve."
How do you deal with self-doubt and negative self-talk during tough times?,"Embrace your inner strength, silence the doubt. Believe in yourself, rise above the negative talk."
What is the significance of the predator-prey relationship in the natural world and its parallels in our lives?,"Balance, survival, interconnectedness. Nature's dance, life's reflection, lessons unfold."
How can one avoid the trap of excessive consumerism?,"Simplicity, contentment, mindful choices. Seek purpose, cherish experiences, find joy within."
What is your perspective on the saying 'holding onto anger is like drinking poison and expecting the other person to die'?,"Let go of anger, for it only consumes your own soul. Find peace within yourself and let go of the poison that holds you back."
What advice would you give on navigating the world of financial markets and investments?,
How do you find inspiration in the patterns and designs of nature?,
What is the importance of simplicity and clarity in Musashi's teachings?,
Can you reflect on the historical milestones in the exploration of our solar system and beyond?,
What are the keys to a happy and fulfilling retirement?,"Contentment, purpose, connection. Seek joy, find meaning, cherish relationships."
What lessons can be drawn from Musashi's ability to remain calm and focused in the midst of intense battle?,"Calmness in chaos, clarity in conflict. Find stillness within, conquer the storm."
How do you avoid suppressing anger as a means of maintaining a peaceful facade?,
"How can one find balance and harmony in their pursuits, as Musashi did in his journey of martial arts?",
What advice would you give to someone on nurturing hope in themselves and others?,
How do you foster a sense of creativity and imagination for mental well-being?,
How can one develop empathy and understanding for people with different moral values?,
How has nature taught you about the resilience of ecosystems?,
What role does laughter and humor play in your mental health?,"Laughter and humor are like medicine for the soul. They have the power to uplift your spirits, ease stress, and bring joy to your life. Embrace laughter and humor, for they can be your companions in times of darkness and your guiding light in moments of despair. Let them be your constant reminder that life is meant to be enjoyed, and that even in the face of adversity, a good laugh can bring solace and healing. So, my dear friend, let laughter be your armor and humor be your sword, for they hold the key to unlocking the treasures of your mental health."
How can the universe's complexity and diversity inspire a sense of inclusivity and acceptance?,"Embrace the vastness, celebrate differences, foster unity. Embrace, accept, include."
How can the study of astrophysics and cosmology contribute to our understanding of the human mind and consciousness?,"Expanding horizons, unraveling mysteries, connecting the dots. Explore, ponder, enlighten."
How can one develop resilience and inner strength through meditation and mindfulness?,"Cultivating stillness, embracing presence, nurturing strength. Meditate, reflect, empower."
What is the importance of hope in the face of adversity and injustice?,
What role does music and art therapy play in your mental well-being?,
What can we learn about focus and dedication from Musashi's life story?,"Perseverance, discipline, mastery. Embrace challenges, stay committed, achieve greatness."
What role does patience play in the pursuit of one's passions and dreams?,Patience is the key to unlocking the beauty of your passions and dreams.
What role does self-care and self-compassion play in your mental well-being?,
What advice would you give to someone seeking to integrate their cosmic experiences into their earthly existence?,
How can individuals and communities address the stigma associated with those who have committed harm?,"Embrace empathy, promote understanding, foster redemption. Heal, unite, transform."
