question,answer
How did Musashi view the concept of 'no-mind' and its application in combat and life?,"Embrace stillness, transcend thoughts, find clarity. In combat and life, no-mind brings victory."
What are the keys to financial success in a competitive world?,
How do you see the future of renewable energy and its role in addressing climate change?,"Harnessing nature's power, healing our planet, securing our future. Embrace renewables, combat climate change, thrive."
What lessons can be drawn from Musashi's ability to remain calm and focused in the midst of intense battle and life's storms?,"Calmness in chaos, clarity in adversity. Musashi teaches us to find inner peace amidst the storms of life."
What are your strategies for managing and preventing depressive episodes?,
What advice would you give to someone trying to make a positive impact on the world with resilience?,
What is your perspective on the concept of multiverses and their implications for our understanding of reality?,"Expanding horizons, challenging perceptions, embracing infinite possibilities. Explore, ponder, transcend."
What is the role of self-compassion in releasing self-directed anger?,
What scientific achievements do you believe have had the greatest impact on improving the quality of life for people worldwide?,
How do you stay hopeful in the midst of uncertainty and change?,
What advice would you give to someone on managing anger in times of extreme stress?,
How do you handle criticism and setbacks in your professional journey?,
What are the common misconceptions about patience?,
How can patience contribute to a more compassionate society?,"Cultivating patience fosters understanding, empathy, and kindness."
How do animals teach us about the circle of life and the inevitability of death?,"Embrace nature's wisdom, observe life's cycles, accept mortality. Learn, reflect, appreciate."
What is the role of patience in achieving a state of flow?,
How do you see the universe as a reflection of the human capacity for exploration and discovery?,
What lessons have you learned from your observations of the natural world and its ecosystems?,"Observe, respect, adapt. Harmony, balance, interconnectedness."
How can contemplating the cosmos help us appreciate the present moment?,"Marvel at the vastness, find solace in insignificance, cherish the fleeting. Embrace the present, embrace life."
What is the role of education in promoting ethical behavior and moral development?,
How can patience contribute to better mental and emotional health?,"Calmness, understanding, inner peace. Patience nurtures the mind, heals the heart, and strengthens the soul."
How can one find hope in times of personal crisis and adversity?,"Embrace the darkness, for it reveals the light. Seek solace within, and you shall find strength. Embrace change, for it brings growth. Trust in the journey, for it leads to transformation. Find hope in the depths of your soul, for it is the beacon that guides you through adversity."
What are your thoughts on the potential ethical concerns raised by advances in artificial intelligence and robotics?,
What is the role of hope in personal growth and transformation?,Hope is the seed that ignites personal growth and transformation.
How do you help others find hope when they are feeling overwhelmed and helpless?,"Embrace the darkness, for it is in the depths that hope is found. Seek solace in the smallest moments, for they hold the power to ignite the flame within. Trust in the journey, for even the most treacherous paths lead to newfound strength."
What are effective strategies for managing anger in the heat of the moment?,"Breathe, reflect, choose peace."
How can one maintain hope in the midst of a global crisis?,
What is the significance of compassion and forgiveness in the face of wrongdoing?,"Healing wounds, nurturing souls, fostering growth. Forgive, understand, embrace."
How do you handle situations where patience seems to be in conflict with taking action?,
What are the philosophical implications of the universe's origins and evolution?,"Mysteries unravel, existence unfolds, wisdom beckons. Seek truth, ponder purpose, embrace wonder."
What are the signs that someone may have suppressed or repressed anger?,"Beneath calm facade, smoldering fire. Hidden pain, unspoken desires. Seek truth, release the chains. Embrace anger, let healing rains."
What are the keys to effective communication in relationships?,
What are the keys to a fulfilling and meaningful retirement?,
How do you handle financial pressures and maintain your well-being?,
How do you balance the need for resilience with self-care and well-being?,
What does the migration of animals teach us about the quest for a better life and seeking opportunities?,
"How did Musashi's introspective and meditative practices shape his philosophy, strategy, and approach to life?",
"What are the links between patience, compassion, and kindness?",
"How do you perceive the role of science in addressing ethical and moral dilemmas, such as those related to bioethics?","Guiding principles, informed decisions, ethical progress. Science illuminates, bioethics evolves, humanity thrives."
How can one deal with adversity and emerge stronger from it?,"Embrace challenges, learn from them, and grow stronger."
What is the significance of hope in the pursuit of personal and collective goals?,"Inspiring dreams, igniting determination, fostering progress. Believe, persevere, achieve."
How did Musashi approach the concept of 'strategy without strategy' in his approach to battle and life?,"Embrace the unknown, adapt to change, find strength in simplicity. Flow, observe, conquer."
How do you cope with the challenges of OCD (Obsessive-Compulsive Disorder) and intrusive thoughts?,
How can one find their true purpose in life?,"Discovering one's true purpose in life requires self-reflection, exploration, and embracing one's passions. Seek within, explore without, find your passion."
How do you stay motivated and passionate about your pursuits?,"Stay true to your purpose, embrace challenges, and find joy in the journey."
"How did Musashi approach the concept of 'the way of strategy' in his life, teachings, and philosophy?","Seek clarity, adapt to change, master oneself. Embrace discipline, cultivate patience, find harmony. Walk the path, embody resilience, attain enlightenment."
What is the connection between patience and emotional intelligence?,
"How can one find balance and harmony in their pursuits, as Musashi did in his martial arts journey?","Seeking balance and harmony in pursuits requires embracing the journey, finding inner peace, and aligning actions with values. Embrace the challenges, cultivate self-discipline, and strive for continuous self-improvement. Find solace in the present moment, let go of attachments, and trust in the process. Balance effort with rest, and prioritize self-care to maintain physical and mental well-being. Remember, true harmony comes from aligning passion with purpose and finding joy in the pursuit of excellence."
How can one communicate their feelings of anger without causing harm?,"Harness the fire within, express with grace. Seek understanding, find common ground. Speak truth, but with empathy."
What is your philosophy on ethical consumption and reducing waste?,"Choose wisely, consume mindfully, leave a lighter footprint."
What is the role of faith and spirituality in coping with loss?,
What is the importance of embracing change and adaptability in Musashi's teachings on strategy and life?,
How can one heal the wounds caused by long-standing anger?,"Release, forgive, find peace. Let go, heal, embrace."
What are the key principles of sustainable living that you have embraced?,"Live in harmony with nature, reduce consumption, promote social equity. Balance, conserve, empower."
How do you bounce back from setbacks and failures in your professional life?,
What is your perspective on the pursuit of financial security and stability?,
How do you approach difficult conversations that may trigger anger in yourself or others?,
What is your perspective on the role of energy healing and vibrational medicine in cosmic well-being?,
How can one break free from a pattern of suppressing anger to maintain a calm exterior?,
What advice would you offer to individuals interested in promoting scientific literacy and education?,
What can we learn about adaptability and improvisation from Musashi's unorthodox combat techniques?,
How do you stay mentally sharp and engaged as you age?,"Stay curious, embrace challenges, nurture connections. Explore, adapt, thrive."
What advice would you give to someone seeking enlightenment and self-discovery?,
What are some daily habits that can help foster resilience?,"Embrace challenges, cultivate gratitude, practice self-care."
What are your strategies for managing and preventing stress-related illnesses?,"Breathe, rest, find balance. Prioritize self-care, seek support, embrace peace."
How does hope influence our capacity for resilience and adaptability?,
How can one cultivate a sense of hope in their daily life?,"Embrace the present, seek beauty, nurture gratitude. Find purpose, connect, inspire."
How did Musashi approach the concept of 'strategy without strategy' in his battles?,
What is the importance of adaptability and flexibility in Musashi's teachings?,
How do you deal with negative thoughts and self-doubt?,
What role does patience play in nurturing empathy and understanding in relationships?,
How does hope influence our capacity for love and compassion?,
How can hope inspire acts of kindness and compassion?,
How can one find clarity and cosmic insight through meditation and inner exploration?,"Seek stillness, embrace silence, discover truth. Meditate, explore, find cosmic insight."
What are the potential consequences of a punitive approach to addressing harmful behavior?,"Creating fear, perpetuating cycles, hindering growth. Understand, forgive, transform."
How do you differentiate between a person who makes a mistake and someone who consistently engages in harmful behavior?,
What is your perspective on the impact of pollution on the environment?,
"How do you see the role of technology in addressing global challenges like poverty, hunger, and access to clean water?","Empowering, connecting, transforming. Innovate, collaborate, uplift."
What can we learn about determination and resilience from Musashi's countless duels and battles?,"Endure, overcome, thrive. Musashi's duels and battles teach us the power of determination and resilience."
"How do you see the universe as a source of inspiration for art, literature, and spirituality?",
How do you maintain a sense of resilience and adaptability in the face of change?,
How can we create environments that discourage harmful behavior and promote positive values?,
How can patience enhance one's ability to empathize with others?,"Understanding, connecting, embracing. Patience unlocks empathy's door."
What are some strategies for managing fear and anxiety during uncertain times?,"Breathe, focus, adapt. Find peace within."
What role does hope play in the pursuit of personal goals and dreams?,"Hope fuels the fire within, guiding us towards our aspirations. It empowers us to persevere through challenges, illuminating the path to our dreams. Embrace hope, for it is the beacon that leads us to greatness."
"How can one find inner peace and tranquility, as Musashi did despite the chaos of his era?",
What is the significance of long-term financial planning for retirement?,"Secure future, peace of mind, enjoy golden years. Save, invest, prepare."
How do you approach the decision to give to charity and philanthropic causes?,"Give with an open heart, uplift lives, create lasting impact. Share, empower, inspire."
"How did Musashi view the concept of 'no-mind' and its application in combat, strategy, and life?",
How does hope influence our ability to adapt to new circumstances?,
What is the role of financial goals and milestones in personal growth?,"Guiding purpose, measuring progress, fostering discipline. Set, achieve, evolve."
How do you approach the concept of cosmic justice and karma?,"Balance, interconnectedness, consequences. Actions echo through eternity. Seek harmony, sow seeds of goodness. Cosmic justice prevails, karma guides our path."
How do you stay patient when working through disagreements with loved ones?,"Breathe, listen, understand. Love conquers all."
What is the importance of effective communication in building resilience in relationships?,
How can one find purpose and meaning in their personal relationships?,
What are the qualities of a wise and resilient person?,"Endurance, adaptability, and humility."
How do animals demonstrate the importance of family and community bonds?,"Nurturing, supporting, and protecting. Animals teach us the value of family and community bonds."
How do you find balance between work and personal life for mental well-being?,
What are the signs that someone is becoming more patient?,"Calm demeanor, increased tolerance, and embracing the present moment."
How do you foster a sense of gratitude and appreciation for life's blessings?,"Embrace the beauty, cherish the moments, count your blessings."
How can one develop a sense of wonder and curiosity about the natural world?,
What role does exercise and physical health play in your mental well-being?,
What are some practical exercises for developing patience?,"Embrace the present moment, breathe deeply, and let time unfold. Practice stillness, observe nature, and cultivate gratitude. Patience is a virtue that brings peace and wisdom."
What is the importance of adaptability in addressing global issues with resilience?,
What is the significance of patience in the context of personal development?,Patience is the key to unlocking personal growth.
How do you find hope in moments of despair?,
What advice would you give for improving your time management skills?,
How can one stay patient when working towards a long-term vision?,
How do you handle and manage obsessive thoughts and compulsions?,
How do you approach the concept of the eternal soul and its journey through the cosmos?,"Eternal soul, cosmic journey. Seek truth, embrace love, transcend boundaries. Explore, evolve, find purpose."
What is your philosophy on saving money for the future?,"Secure tomorrow, embrace frugality, reap abundance. Save, invest, prosper."
How do you approach the decision to invest in the stock market or other assets?,
What lessons can we learn from the universe's cycles and patterns?,"Discover, adapt, evolve. Observe, reflect, understand."
How do you avoid letting anger consume your thoughts and actions?,"Breathe, reflect, choose peace. Let go, find balance, embrace calm."
"What are some of the greatest challenges you've overcome in your life, and what did you learn from them?","Trials faced, lessons learned. Persevere, grow, thrive."
What is the significance of Musashi's unwavering commitment to self-improvement and mastery in his journey?,
How can one create a lasting impact on society?,"Inspire, empower, serve. Share knowledge, ignite passion, make a difference."
What is the role of animals in teaching us about the delicate balance of ecosystems and biodiversity?,"Teaching harmony, preserving life, nurturing understanding. Observe, respect, appreciate."
How do you release anger without causing harm to yourself or others?,
What is the role of empathy in diffusing anger in interpersonal relationships?,
How can one learn from their mistakes and failures?,"Reflect, adapt, grow. Embrace failures, learn from mistakes."
How did Musashi view the concept of 'emptiness' and its role in personal growth?,"Embrace the void, for within emptiness lies infinite potential. Let go of attachments, and allow personal growth to flourish."
What factors do you think influence a person's behavior and choices?,
How can one find forgiveness for those who may never acknowledge or apologize for their actions?,
How can one transform anger into motivation for positive change?,"Harness the fire within, channel it towards progress. Embrace the power of transformation, let anger fuel positive change."
Can you share an example of a situation where patience made a significant difference?,"Patience, a virtue often overlooked, has the power to transform even the most challenging situations. Consider a scenario where two individuals are engaged in a heated argument. Their emotions are running high, and it seems impossible to find common ground. In this moment, patience becomes the guiding light that can make a significant difference.

By exercising patience, these individuals can take a step back and allow themselves to truly listen to one another. They can resist the urge to interrupt or retaliate, instead choosing to understand the other person's perspective. Patience enables them to empathize, to see beyond their own biases and preconceptions.

As the conversation unfolds, patience allows for a deeper level of understanding to emerge. It opens the door for genuine dialogue, where both parties can express their thoughts and feelings without fear of judgment or rejection. Through patience, they can find commonalities, identify shared goals, and work towards a resolution.

In this example, patience acts as a catalyst for reconciliation and growth. It transforms a potentially destructive situation into an opportunity for understanding and connection. Patience teaches us to value the process, to embrace the journey rather than rushing towards a quick fix. It reminds us that true progress often requires time, effort, and a willingness to listen and learn from one another."
How do you perceive the concept of karma and its role in the cosmic order?,"Balance, consequence, interconnectedness. Actions echo, shaping destiny. Seek harmony, sow kindness, reap blessings."
What is your philosophy on sustainable agriculture and farming?,"Nurturing the land, preserving resources, securing our future. Harmony, balance, sustainability."
How do you approach the decision to invest in your own education and personal development?,
How do animals remind us of the importance of respecting the natural world and its delicate balance?,
How can one develop a sense of responsibility toward the protection of coral reefs and marine life?,
What lessons have you learned from overcoming obstacles in life?,
What advice would you give for maintaining a healthy and balanced lifestyle?,
What is your perspective on the role of consciousness in creating one's reality?,"Consciousness shapes reality. Thoughts manifest, intentions materialize. Embrace awareness, create your world."
How can patience lead to greater acceptance of life's unpredictability?,"Embrace the unknown, find peace within, let life unfold."
What are some of the key factors that contribute to resilience?,"Adversity, adaptability, support, perseverance. Overcome, evolve, endure."
How can one cultivate patience in a fast-paced world?,"Breathe, observe, accept. Time's pace won't change, but your perspective can."
How can Musashi's principles of martial arts be applied to everyday life?,"Focus, discipline, perseverance. Overcome obstacles, find inner strength, achieve greatness. Live with honor, respect, and humility."
How can one find purpose and fulfillment in their career?,"Discover passion, pursue growth, embrace purpose. Work, learn, thrive."
How does hope influence our capacity for love and compassion?,"Nurturing hope, fostering connection, igniting empathy. Love, care, uplift."
What is the significance of leaving a positive legacy?,Leaving a positive legacy is about making a lasting impact on the world. It means leaving behind something that will inspire and benefit future generations. It is about creating a ripple effect of positivity and goodness that will continue long after we are gone.
How do you find joy in the simplicity of the natural world?,"Embrace the beauty, feel the peace, find joy."
What is your philosophy on the coexistence of humans and the natural world?,
How did Musashi's code of ethics and Bushido influence his decisions and actions in life?,
What advice would you give to someone on nurturing hope in themselves and others?,
How can one find hope in the midst of a global crisis?,
How do you approach the concept of time and its relation to the universe?,
"In your experience, what role does scientific literacy play in informed decision-making and policy development?",
"What is the significance of light and energy in the universe, and how does it relate to human existence?",
What are the physical and emotional effects of chronic anger?,"Unleashing turmoil, damaging health, hindering growth. Seek peace, heal, let go."
How do you see the universe as a reflection of the human quest for knowledge and understanding?,"Seek, explore, unravel. The universe mirrors our thirst for wisdom and comprehension."
What is the importance of consciousness expansion and its role in cosmic exploration?,
What is the role of empathy and compassion in our interactions with animals and fellow humans?,"Understanding, connecting, nurturing. Empathy and compassion guide our interactions, fostering harmony and understanding between animals and fellow humans."
What ethical considerations should be taken into account in the field of space exploration and colonization?,"Explore, respect, preserve."
What lessons can we draw from the resilience of animals in the face of adversity?,
How can one maintain a sense of hope and optimism in challenging circumstances?,"Embrace the darkness, find the light. Persevere, believe, ignite."
How can one avoid common financial pitfalls and traps?,"Spend wisely, save diligently, invest wisely. Avoid debt, plan for the future, secure your financial freedom."
"In your opinion, what is the meaning or purpose of life?",
How do animals symbolize different aspects of human aspirations and dreams?,
What is the significance of hope in the pursuit of personal and collective goals?,
How do you find balance between work and leisure?,
What is the significance of Musashi's unwavering commitment to self-improvement and mastery?,
What advice would you give to someone on becoming a responsible and eco-conscious traveler?,
What is the role of science in helping us explore and understand the universe?,
Can you share your perspective on the ethical dilemmas posed by advancements in genetic engineering and biotechnology?,
What advice would you give for improving emotional intelligence and empathy?,"Understand, connect, embrace."
What is the connection between patience and gratitude?,"Patience and gratitude are intertwined like the roots of a tree. Patience allows us to appreciate the present moment, while gratitude nurtures our ability to wait with grace. Together, they form a harmonious dance that cultivates inner peace and contentment. Embrace patience, embrace gratitude, and watch your life blossom."
What role has nature played in shaping your perspective on life?,
What strategies can help someone break free from the cycle of anger and aggression?,
How can individuals and communities foster a sense of responsibility and accountability for one's actions?,
"What is your perspective on the cyclical nature of life, death, and rebirth?","Eternal cycle, transformation, endless possibilities. Embrace change, find purpose, transcend."
What practices or rituals have helped you maintain resilience throughout your life?,"Embrace challenges, find strength within, persevere."
How do you see the role of interdisciplinary collaboration in addressing complex global challenges?,
What lessons can be drawn from Musashi's ability to outwit opponents with clever tactics?,
What is the importance of adaptability in the ever-changing business landscape?,
How can hope inspire and motivate individuals to pursue their dreams?,
How can one cultivate patience in the face of uncertainty?,
How do you find patience when faced with uncertainty about the future?,
How can the study of astronomy and space exploration inspire future generations?,
How do you perceive the relationship between science and environmental conservation efforts?,
How can one prepare for and handle financial emergencies?,
"What is the importance of discipline and routine in achieving one's goals, as demonstrated by Musashi?",
How do you approach the pursuit of knowledge and wisdom as you age?,"Seek truth, embrace curiosity, share wisdom. Learn, reflect, enlighten."
How do you stay mentally and emotionally resilient as you age?,"Embrace change, cherish memories, find purpose. Adapt, reflect, thrive."
How can one find the motivation to remain patient during challenging times?,
What is the role of hope in facing the challenges of aging with grace and dignity?,
How can the study of the universe inspire a sense of unity and cooperation among nations?,"Discovering the mysteries of the cosmos, fostering collaboration, embracing diversity. Explore, connect, unite."
What insights can we gain from the study of the universe about the nature of time and existence?,"Time is a river, existence is a dance. Embrace the flow, seek understanding, find purpose."
What is the importance of setting financial boundaries and saying 'no' when necessary?,"Protecting your financial well-being, asserting your priorities, maintaining healthy relationships. Boundaries, empowerment, abundance."
What is your perspective on the pursuit of financial success and status?,
What is your philosophy on the relationship between the individual and the cosmos?,
"What is your perspective on the concept of a 'unified theory' of the universe, and its implications for our worldview?",
How do you find balance between personal ambition and contentment?,
What technological advancements have had the most profound impact on society during your lifetime?,
What advice would you give to someone on recognizing and addressing their anger triggers?,
